{
  "version": 1,
  "feature_id": "F1-stock-visibility",
  "stories": {
    "S1-record-stock": {
      "status": "done",
      "gate": {
        "status": "approved",
        "history": [
          {
            "action": "approved",
            "at": "2026-06-15T09:00:15.846Z",
            "approver": "human-proxy"
          }
        ],
        "approver": "human-proxy",
        "approved_at": "2026-06-15T09:00:15.846Z"
      },
      "experiment": {
        "slug": "exp1",
        "branch": "experiment-s1-record-stock-exp1",
        "parent": "feature-f1-stock-visibility",
        "n": 1,
        "status": "merged",
        "cut_at": "2026-06-15T09:00:16.341Z",
        "closed_at": "2026-06-15T09:59:07.025Z"
      },
      "acceptance": {
        "decision": "accepted",
        "history": [
          {
            "decision": "accepted",
            "at": "2026-06-15T09:58:53.186Z",
            "approver": "human-proxy"
          },
          {
            "decision": "accepted",
            "at": "2026-06-15T09:59:07.025Z",
            "approver": "human-proxy"
          }
        ],
        "approver": "human-proxy",
        "at": "2026-06-15T09:59:07.025Z"
      }
    },
    "S2-home-stock-table": {
      "status": "awaiting-acceptance",
      "gate": {
        "status": "approved",
        "history": [
          {
            "action": "approved",
            "at": "2026-06-15T09:59:08.674Z",
            "approver": "human-proxy"
          }
        ],
        "approver": "human-proxy",
        "approved_at": "2026-06-15T09:59:08.674Z"
      },
      "experiment": {
        "slug": "exp1",
        "branch": "experiment-s2-home-stock-table-exp1",
        "parent": "feature-f1-stock-visibility",
        "n": 1,
        "status": "active",
        "cut_at": "2026-06-15T09:59:09.108Z"
      },
      "acceptance": {
        "decision": null,
        "history": []
      }
    },
    "S3-sku-detail-view": {
      "status": "designing"
    }
  },
  "build_queue": [],
  "build_active": "S2-home-stock-table"
}
