{
  "version": 1,
  "feature_id": "F1-stock-visibility",
  "stories": {
    "S1-record-stock": {
      "status": "ready",
      "gate": {
        "status": "approved",
        "history": [
          {
            "action": "approved",
            "at": "2026-06-15T09:00:15.846Z",
            "approver": "human-proxy"
          }
        ],
        "approver": "human-proxy",
        "approved_at": "2026-06-15T09:00:15.846Z"
      }
    },
    "S2-home-stock-table": {
      "status": "designing"
    },
    "S3-sku-detail-view": {
      "status": "designing"
    }
  },
  "build_queue": [
    "S1-record-stock"
  ],
  "build_active": null
}
