{
  "version": 1,
  "feature_id": "F6-split-tracking-code",
  "stories": {
    "S1-split-schema-migration": {
      "status": "building",
      "gate": {
        "status": "approved",
        "history": [
          {
            "action": "approved",
            "at": "2026-07-11T21:58:58.996Z",
            "approver": "human-proxy"
          }
        ],
        "approver": "human-proxy",
        "approved_at": "2026-07-11T21:58:58.996Z"
      }
    },
    "S2-detail-view-split-fields": {
      "status": "designing"
    }
  },
  "build_queue": [],
  "build_active": "S1-split-schema-migration"
}
