{
  "version": 1,
  "feature_id": "F6-split-tracking-code",
  "stories": {
    "S1-split-schema-migration": {
      "status": "awaiting-gate",
      "gate": {
        "status": "open",
        "history": []
      }
    },
    "S2-detail-view-split-fields": {
      "status": "designing"
    }
  },
  "build_queue": [],
  "build_active": null
}
