{
  "version": 1,
  "feature_id": "F6-split-tracking-code",
  "stories": {
    "S1-split-add-backfill": {
      "status": "building",
      "gate": {
        "status": "approved",
        "history": [
          {
            "action": "approved",
            "at": "2026-06-15T10:33:54.501Z",
            "approver": "human-proxy"
          }
        ],
        "approver": "human-proxy",
        "approved_at": "2026-06-15T10:33:54.501Z"
      },
      "experiment": {
        "slug": "exp1",
        "branch": "experiment-s1-split-add-backfill-exp1",
        "parent": "feature-f6-split-tracking-code",
        "n": 1,
        "status": "active",
        "cut_at": "2026-06-15T10:33:55.360Z"
      }
    },
    "S2-split-validate": {
      "status": "designing"
    },
    "S3-split-drop-old": {
      "status": "designing"
    },
    "S4-split-display": {
      "status": "designing"
    }
  },
  "build_queue": [],
  "build_active": "S1-split-add-backfill"
}
