{
  "version": 1,
  "feature_id": "F6-split-tracking-code",
  "stories": {
    "S1-split-add-backfill": {
      "status": "done",
      "gate": {
        "status": "approved",
        "history": [
          {
            "action": "approved",
            "at": "2026-06-15T10:33:54.501Z",
            "approver": "human-proxy"
          }
        ],
        "approver": "human-proxy",
        "approved_at": "2026-06-15T10:33:54.501Z"
      },
      "experiment": {
        "slug": "exp1",
        "branch": "experiment-s1-split-add-backfill-exp1",
        "parent": "feature-f6-split-tracking-code",
        "n": 1,
        "status": "merged",
        "cut_at": "2026-06-15T10:33:55.360Z",
        "closed_at": "2026-06-15T11:29:34.224Z"
      },
      "acceptance": {
        "decision": "accepted",
        "history": [
          {
            "decision": "accepted",
            "at": "2026-06-15T11:29:20.793Z",
            "approver": "human-proxy"
          },
          {
            "decision": "accepted",
            "at": "2026-06-15T11:29:34.224Z",
            "approver": "human-proxy"
          }
        ],
        "approver": "human-proxy",
        "at": "2026-06-15T11:29:34.224Z"
      }
    },
    "S2-split-validate": {
      "status": "done",
      "gate": {
        "status": "approved",
        "history": [
          {
            "action": "approved",
            "at": "2026-06-15T11:29:36.329Z",
            "approver": "human-proxy"
          }
        ],
        "approver": "human-proxy",
        "approved_at": "2026-06-15T11:29:36.329Z"
      },
      "experiment": {
        "slug": "exp1",
        "branch": "experiment-s2-split-validate-exp1",
        "parent": "feature-f6-split-tracking-code",
        "n": 1,
        "status": "merged",
        "cut_at": "2026-06-15T11:29:37.084Z",
        "closed_at": "2026-06-15T11:54:16.018Z"
      },
      "acceptance": {
        "decision": "accepted",
        "history": [
          {
            "decision": "accepted",
            "at": "2026-06-15T11:54:03.096Z",
            "approver": "human-proxy"
          },
          {
            "decision": "accepted",
            "at": "2026-06-15T11:54:16.018Z",
            "approver": "human-proxy"
          }
        ],
        "approver": "human-proxy",
        "at": "2026-06-15T11:54:16.018Z"
      }
    },
    "S3-split-drop-old": {
      "status": "done",
      "gate": {
        "status": "approved",
        "history": [
          {
            "action": "approved",
            "at": "2026-06-15T11:54:18.001Z",
            "approver": "human-proxy"
          },
          {
            "action": "approved",
            "at": "2026-06-15T12:09:18.001Z",
            "approver": "human-proxy"
          }
        ],
        "approver": "human-proxy",
        "approved_at": "2026-06-15T12:09:18.001Z"
      },
      "experiment": {
        "slug": "exp1",
        "branch": "experiment-s3-split-drop-old-exp1",
        "parent": "feature-f6-split-tracking-code",
        "n": 1,
        "status": "merged",
        "cut_at": "2026-06-15T12:24:18.370Z",
        "closed_at": "2026-06-15T16:46:43.313Z"
      },
      "acceptance": {
        "decision": "accepted",
        "history": [
          {
            "decision": "accepted",
            "at": "2026-06-15T16:46:27.530Z",
            "approver": "human-proxy"
          },
          {
            "decision": "accepted",
            "at": "2026-06-15T16:46:43.313Z",
            "approver": "human-proxy"
          }
        ],
        "approver": "human-proxy",
        "at": "2026-06-15T16:46:43.313Z"
      }
    },
    "S4-split-display": {
      "status": "awaiting-acceptance",
      "gate": {
        "status": "approved",
        "history": [
          {
            "action": "approved",
            "at": "2026-06-15T16:55:07.672Z",
            "approver": "human-proxy"
          }
        ],
        "approver": "human-proxy",
        "approved_at": "2026-06-15T16:55:07.672Z"
      },
      "experiment": {
        "slug": "exp1",
        "branch": "experiment-s4-split-display-exp1",
        "parent": "feature-f6-split-tracking-code",
        "n": 1,
        "status": "active",
        "cut_at": "2026-06-15T16:55:08.327Z"
      },
      "acceptance": {
        "decision": null,
        "history": []
      }
    }
  },
  "build_queue": [],
  "build_active": "S4-split-display"
}
